{
  "$schema": "https://json-schema.org/draft/2020-12/schema",
  "$id": "https://arkhamhorror.app/schemas/locale-catalog/v1/manifest.schema.json",
  "title": "Arkham Horror locale catalog manifest (v1)",
  "description": "Index of the published locale catalog. Served unauthenticated at <basePath>/manifest.json and, byte-identically, at the immutable revision path. Every chunk is pinned by size and SHA-256, so a client can verify what it downloaded against what this manifest promised.",
  "type": "object",
  "additionalProperties": false,
  "required": [
    "schemaVersion",
    "catalogRevision",
    "basePath",
    "manifestPath",
    "revisionManifestPath",
    "chunkPathPrefix",
    "digestAlgorithm",
    "defaultLocale",
    "languageResolution",
    "locales",
    "totals",
    "backend",
    "provenance"
  ],
  "properties": {
    "schemaVersion": {
      "type": "string",
      "const": "1.0.0"
    },
    "catalogRevision": {
      "description": "Deterministic content revision: '1.' plus the first 32 hex characters of provenance.sha256.",
      "type": "string",
      "pattern": "^1\\.[0-9a-f]{32}$"
    },
    "basePath": {
      "description": "The route this catalog is published at. Pinned: prod.nginxconf serves exactly this prefix.",
      "const": "/locale-catalog"
    },
    "manifestPath": {
      "description": "Stable manifest URL. Pinned to the published route.",
      "const": "/locale-catalog/manifest.json"
    },
    "revisionManifestPath": {
      "description": "Immutable manifest URL for this revision; must be the path catalogRevision derives.",
      "type": "string",
      "pattern": "^/locale-catalog/r/1\\.[0-9a-f]{32}/manifest\\.json$"
    },
    "chunkPathPrefix": {
      "description": "Prefix of every content-addressed chunk URL. Chunk paths carry only the content digest, so an unchanged pack keeps its URL across revisions and stays available from replicas of either revision during a rolling deploy. Pinned to the published route.",
      "const": "/locale-catalog/c/"
    },
    "digestAlgorithm": {
      "const": "sha256"
    },
    "defaultLocale": {
      "$ref": "#/$defs/locale"
    },
    "languageResolution": {
      "description": "How the production web client resolves BCP-47 tags to catalog locales, so native clients match it exactly.",
      "type": "array",
      "minItems": 1,
      "items": {
        "type": "object",
        "additionalProperties": false,
        "required": [
          "tag",
          "locale"
        ],
        "properties": {
          "tag": {
            "type": "string",
            "pattern": "^[A-Za-z]{2,3}(-[A-Za-z0-9]{2,8})*$"
          },
          "locale": {
            "$ref": "#/$defs/locale"
          }
        }
      }
    },
    "locales": {
      "type": "array",
      "minItems": 1,
      "items": {
        "type": "object",
        "additionalProperties": false,
        "required": [
          "locale",
          "fallback",
          "chunks",
          "keys",
          "bytes"
        ],
        "properties": {
          "locale": {
            "$ref": "#/$defs/locale"
          },
          "fallback": {
            "oneOf": [
              {
                "$ref": "#/$defs/locale"
              },
              {
                "type": "null"
              }
            ]
          },
          "keys": {
            "$ref": "#/$defs/count"
          },
          "bytes": {
            "$ref": "#/$defs/count"
          },
          "chunks": {
            "type": "array",
            "minItems": 1,
            "items": {
              "type": "object",
              "additionalProperties": false,
              "required": [
                "pack",
                "path",
                "bytes",
                "sha256",
                "keys",
                "unsupportedKeys"
              ],
              "properties": {
                "pack": {
                  "type": "string",
                  "pattern": "^[A-Za-z0-9][A-Za-z0-9_-]{0,63}$"
                },
                "path": {
                  "description": "Immutable, content-addressed absolute path under the published route. Its bytes can never change behind this URL.",
                  "type": "string",
                  "pattern": "^/locale-catalog/c/[0-9a-f]{64}\\.json$"
                },
                "bytes": {
                  "$ref": "#/$defs/count"
                },
                "sha256": {
                  "$ref": "#/$defs/sha256"
                },
                "keys": {
                  "$ref": "#/$defs/count"
                },
                "unsupportedKeys": {
                  "$ref": "#/$defs/count"
                }
              }
            },
            "maxItems": 256
          }
        }
      },
      "maxItems": 64
    },
    "totals": {
      "type": "object",
      "additionalProperties": false,
      "required": [
        "locales",
        "chunks",
        "bytes",
        "keys",
        "unsupportedKeys"
      ],
      "properties": {
        "locales": {
          "$ref": "#/$defs/count"
        },
        "chunks": {
          "$ref": "#/$defs/count"
        },
        "bytes": {
          "$ref": "#/$defs/count"
        },
        "keys": {
          "$ref": "#/$defs/count"
        },
        "unsupportedKeys": {
          "$ref": "#/$defs/count"
        }
      }
    },
    "backend": {
      "description": "What the running backend actually emits, taken from the machine-derived registry in backend/arkham-api/i18n-emitted-keys.json. Every emitted key the default locale translates is published and renderable; the rest are reported here rather than hidden.",
      "type": "object",
      "additionalProperties": false,
      "required": [
        "artifactPath",
        "artifactSha256",
        "sourceSha256",
        "emittedKeys",
        "requiredKeys",
        "untranslatedKeys",
        "variableGaps",
        "dynamicSites",
        "unknownVariableTypes"
      ],
      "properties": {
        "artifactPath": {
          "type": "string",
          "pattern": "^[A-Za-z0-9][A-Za-z0-9._/-]*\\.json$"
        },
        "artifactSha256": {
          "$ref": "#/$defs/sha256"
        },
        "sourceSha256": {
          "$ref": "#/$defs/sha256"
        },
        "emittedKeys": {
          "$ref": "#/$defs/count"
        },
        "requiredKeys": {
          "$ref": "#/$defs/count"
        },
        "untranslatedKeys": {
          "description": "Keys the backend emits that no default-locale message translates. Clients render these as unavailable; the gate fails when the list changes without the artifact being regenerated.",
          "type": "array",
          "uniqueItems": true,
          "items": {
            "$ref": "#/$defs/messageKey"
          }
        },
        "variableGaps": {
          "description": "Required keys whose message needs a substitution the extracted backend record does not list. `resolved` marks the cases where the extractor did resolve that key's variables, so the mismatch is a genuine contradiction rather than an unresolved call site.",
          "type": "array",
          "items": {
            "type": "object",
            "additionalProperties": false,
            "required": [
              "key",
              "missing",
              "resolved"
            ],
            "properties": {
              "key": {
                "$ref": "#/$defs/messageKey"
              },
              "missing": {
                "type": "array",
                "items": {
                  "type": "string",
                  "pattern": "^[A-Za-z0-9_]{1,64}$"
                }
              },
              "resolved": {
                "type": "boolean"
              }
            }
          }
        },
        "dynamicSites": {
          "description": "Emission sites in the backend whose key or scope is not statically resolvable, as counted by the extractor.",
          "$ref": "#/$defs/count"
        },
        "unknownVariableTypes": {
          "description": "Required keys whose message needs a variable the backend does not send in a form the slot can render. Those entries are published as `unsupported` with reason `unusable-variable-type`; a consumer must treat them as unavailable.",
          "type": "array",
          "items": {
            "type": "object",
            "additionalProperties": false,
            "required": [
              "key",
              "variable",
              "role",
              "type"
            ],
            "properties": {
              "key": {
                "$ref": "#/$defs/messageKey"
              },
              "variable": {
                "type": "string",
                "pattern": "^[A-Za-z0-9_]{1,64}$"
              },
              "role": {
                "enum": [
                  "text",
                  "iconVariable"
                ]
              },
              "type": {
                "type": "string",
                "maxLength": 32
              }
            }
          }
        }
      }
    },
    "provenance": {
      "description": "Binds this revision to the exact bytes it was generated from: locale sources, schemas, generator, toolchain, the resolved dependency closure, the backend registry, and the rendered output itself.",
      "type": "object",
      "additionalProperties": false,
      "required": [
        "sha256",
        "outputSha256",
        "generator",
        "contractRevision",
        "fixtureKeys",
        "localeSourceFiles",
        "localeSourcesSha256",
        "schemasSha256",
        "generatorSha256"
      ],
      "properties": {
        "sha256": {
          "$ref": "#/$defs/sha256"
        },
        "outputSha256": {
          "description": "Digest of the rendered catalog content before it was addressed, so the revision changes when the output changes even if the inputs look the same.",
          "$ref": "#/$defs/sha256"
        },
        "generator": {
          "type": "object",
          "additionalProperties": false,
          "required": [
            "name",
            "version"
          ],
          "properties": {
            "name": {
              "const": "arkham-locale-catalog"
            },
            "version": {
              "type": "string",
              "pattern": "^[0-9]+\\.[0-9]+\\.[0-9]+$"
            }
          }
        },
        "contractRevision": {
          "type": "string",
          "pattern": "^[0-9]+(\\.[0-9]+)*$"
        },
        "fixtureKeys": {
          "description": "Keys taken from the governed contract fixtures that this revision guarantees resolve in the default locale.",
          "type": "array",
          "minItems": 1,
          "uniqueItems": true,
          "items": {
            "$ref": "#/$defs/messageKey"
          }
        },
        "localeSourceFiles": {
          "$ref": "#/$defs/count"
        },
        "localeSourcesSha256": {
          "$ref": "#/$defs/sha256"
        },
        "schemasSha256": {
          "$ref": "#/$defs/sha256"
        },
        "generatorSha256": {
          "$ref": "#/$defs/sha256"
        }
      }
    }
  },
  "$defs": {
    "absolutePath": {
      "type": "string",
      "pattern": "^/[A-Za-z0-9][A-Za-z0-9._/-]*$",
      "not": {
        "pattern": "(^|/)\\.\\.?(/|$)"
      }
    },
    "locale": {
      "type": "string",
      "pattern": "^[a-z]{2,3}(-[A-Za-z0-9]{2,8})*$"
    },
    "messageKey": {
      "description": "Dotted vue-i18n key, using the same grammar as the chunk schema so any key the catalog can publish can also be named here.",
      "type": "string",
      "maxLength": 512,
      "pattern": "^[^\\u0000-\\u001f\\u007f./\\\\\\ue000\\ue001]+(\\.[^\\u0000-\\u001f\\u007f./\\\\\\ue000\\ue001]+)*$"
    },
    "sha256": {
      "type": "string",
      "pattern": "^[0-9a-f]{64}$"
    },
    "count": {
      "type": "integer",
      "minimum": 0
    }
  }
}
