{
  "schemaVersion": "1.0.0",
  "catalogRevision": "1.9fa2c4af86c0bb5aa12ba9aa31b50851",
  "basePath": "/locale-catalog",
  "manifestPath": "/locale-catalog/manifest.json",
  "revisionManifestPath": "/locale-catalog/r/1.9fa2c4af86c0bb5aa12ba9aa31b50851/manifest.json",
  "chunkPathPrefix": "/locale-catalog/c/",
  "digestAlgorithm": "sha256",
  "defaultLocale": "en",
  "languageResolution": [
    {
      "tag": "de",
      "locale": "de"
    },
    {
      "tag": "en",
      "locale": "en"
    },
    {
      "tag": "pt",
      "locale": "pt-BR"
    },
    {
      "tag": "pt-BR",
      "locale": "pt-BR"
    }
  ],
  "locales": [
    {
      "locale": "de",
      "fallback": "en",
      "keys": 1,
      "bytes": 288,
      "chunks": [
        {
          "pack": "core",
          "path": "/locale-catalog/c/2efb9d458b5dd9b7ae9a284c277ca68e47a40212c95ce85da5b50f598d9fc448.json",
          "bytes": 288,
          "sha256": "2efb9d458b5dd9b7ae9a284c277ca68e47a40212c95ce85da5b50f598d9fc448",
          "keys": 1,
          "unsupportedKeys": 0
        }
      ]
    },
    {
      "locale": "en",
      "fallback": null,
      "keys": 9,
      "bytes": 2283,
      "chunks": [
        {
          "pack": "core",
          "path": "/locale-catalog/c/9a30c62c45fb06a929d13506b454d5b9637c5bf3eeb986243ddb007a856cb1a5.json",
          "bytes": 1279,
          "sha256": "9a30c62c45fb06a929d13506b454d5b9637c5bf3eeb986243ddb007a856cb1a5",
          "keys": 5,
          "unsupportedKeys": 1
        },
        {
          "pack": "nightOfTheZealot",
          "path": "/locale-catalog/c/d951fedc2b5f0644bb126beb77f6e03a2abad3627c274985e9b8a42b09116693.json",
          "bytes": 1004,
          "sha256": "d951fedc2b5f0644bb126beb77f6e03a2abad3627c274985e9b8a42b09116693",
          "keys": 4,
          "unsupportedKeys": 0
        }
      ]
    },
    {
      "locale": "pt-BR",
      "fallback": "en",
      "keys": 1,
      "bytes": 294,
      "chunks": [
        {
          "pack": "core",
          "path": "/locale-catalog/c/309d63c6b0ab62a2fc4bc993860a820b05c156f2e7d67439a24b487839df1488.json",
          "bytes": 294,
          "sha256": "309d63c6b0ab62a2fc4bc993860a820b05c156f2e7d67439a24b487839df1488",
          "keys": 1,
          "unsupportedKeys": 0
        }
      ]
    }
  ],
  "totals": {
    "locales": 3,
    "chunks": 4,
    "bytes": 2865,
    "keys": 11,
    "unsupportedKeys": 1
  },
  "backend": {
    "artifactPath": "contracts/fixtures/locale-catalog-backend-registry.json",
    "artifactSha256": "dd5499efa098c6b99492115fc06f55bc21b8d46d4434f9b5fa94bb1aa104180e",
    "sourceSha256": "4eedff6ab67d9ccba6c1c136f053c18ca8572f5159ffc7f5a612b513e9e9903e",
    "emittedKeys": 10,
    "requiredKeys": 10,
    "untranslatedKeys": [
      "nightOfTheZealot.theGathering.setup.setOutOfPlay"
    ],
    "variableGaps": [],
    "dynamicSites": 0,
    "unknownVariableTypes": []
  },
  "provenance": {
    "sha256": "9fa2c4af86c0bb5aa12ba9aa31b508516964e1da85b3ac6d4d591f3d63513f47",
    "outputSha256": "b6801c96f5d9388e5498ea82b84dcc943e8b3b68f5fa996304efc740d7f4a0ec",
    "generator": {
      "name": "arkham-locale-catalog",
      "version": "1.0.0"
    },
    "contractRevision": "0.1.53",
    "fixtureKeys": [
      "addToken",
      "continue",
      "label.doneWithMulligan",
      "nightOfTheZealot.theGathering.intro.body",
      "nightOfTheZealot.theGathering.intro.title",
      "nightOfTheZealot.theGathering.setup.gatherSets",
      "nightOfTheZealot.theGathering.setup.placeLocations",
      "nightOfTheZealot.theGathering.setup.setOutOfPlay",
      "setup",
      "shuffleRemainder"
    ],
    "localeSourceFiles": 3,
    "localeSourcesSha256": "4eedff6ab67d9ccba6c1c136f053c18ca8572f5159ffc7f5a612b513e9e9903e",
    "schemasSha256": "1a7c5d1a585bcf495f2c8698c74f885a5732886a51a3409aafd3d9c34191571a",
    "generatorSha256": "bfb60ae31043550bc52f922780722e95f09896edc370ea22f4a68391de0e8fc0"
  }
}
